{
  "schema_version": "1.0",
  "pptx": "private-artifacts/pptsmith-pmo-consulting-pack/output/pmo-reference-visual-styles.pptx",
  "pptx_sha256": "sha256:fb329265a35be211d1a0e54002ff2207bfb8fa2f4bdb5f72ea6f742f3480ef54",
  "slide_count": 6,
  "status": "passed",
  "metrics": {
    "native_text_character_count": 1229,
    "expected_text_character_count": 0,
    "native_text_ratio": null,
    "native_table_count": 0,
    "native_chart_count": 6,
    "native_connector_count": 11,
    "rasterized_area_ratio": 0.0,
    "whole_slide_raster_count": 0,
    "average_object_count": 29.1667
  },
  "slides": [
    {
      "slide_index": 1,
      "slide_id": "S01",
      "objects": [
        {
          "object_id": "ppt-object-1-1",
          "slide_id": "S01",
          "shape_id": 2,
          "shape_type": "text",
          "name": "Text: DASHBOARD GAUGE",
          "x_in": 0.56,
          "y_in": 0.25,
          "w_in": 4.5,
          "h_in": 0.2,
          "area_ratio": 0.009,
          "text": "DASHBOARD GAUGE",
          "font_sizes_pt": [
            8.5
          ],
          "fill_colors": [],
          "line_colors": [],
          "source_relationship": null,
          "font_families": [
            "Microsoft YaHei"
          ],
          "image_ext": null,
          "image_px": null
        },
        {
          "object_id": "ppt-object-1-2",
          "slide_id": "S01",
          "shape_id": 3,
          "shape_type": "text",
          "name": "Text: 半圆仪表盘把状态、缺口和行动优先级压在同一视线内",
          "x_in": 0.56,
          "y_in": 0.5,
          "w_in": 12.0,
          "h_in": 0.5,
          "area_ratio": 0.060002,
          "text": "半圆仪表盘把状态、缺口和行动优先级压在同一视线内",
          "font_sizes_pt": [
            21.0
          ],
          "fill_colors": [],
          "line_colors": [],
          "source_relationship": null,
          "font_families": [
            "Microsoft YaHei"
          ],
          "image_ext": null,
          "image_px": null
        },
        {
          "object_id": "ppt-object-1-3",
          "slide_id": "S01",
          "shape_id": 4,
          "shape_type": "connector",
          "name": "Connector: native line",
          "x_in": 0.56,
          "y_in": 1.12,
          "w_in": 12.22,
          "h_in": 0.0,
          "area_ratio": 0.0,
          "text": "",
          "font_sizes_pt": [],
          "fill_colors": [],
          "line_colors": [],
          "source_relationship": null,
          "font_families": [],
          "image_ext": null,
          "image_px": null
        },
        {
          "object_id": "ppt-object-1-4",
          "slide_id": "S01",
          "shape_id": 5,
          "shape_type": "text",
          "name": "Text: VISUAL STYLE PROTOTYPE / 01",
          "x_in": 9.42,
          "y_in": 7.12,
          "w_in": 3.3,
          "h_in": 0.18,
          "area_ratio": 0.00594,
          "text": "VISUAL STYLE PROTOTYPE / 01",
          "font_sizes_pt": [
            7.8
          ],
          "fill_colors": [],
          "line_colors": [],
          "source_relationship": null,
          "font_families": [
            "Microsoft YaHei"
          ],
          "image_ext": null,
          "image_px": null
        },
        {
          "object_id": "ppt-object-1-5",
          "slide_id": "S01",
          "shape_id": 6,
          "shape_type": "text",
          "name": "Material: gauge base arc",
          "x_in": 1.1,
          "y_in": 1.95,
          "w_in": 3.95,
          "h_in": 3.2,
          "area_ratio": 0.126403,
          "text": "",
          "font_sizes_pt": [],
          "fill_colors": [],
          "line_colors": [],
          "source_relationship": null,
          "font_families": [],
          "image_ext": null,
          "image_px": null
        },
        {
          "object_id": "ppt-object-1-6",
          "slide_id": "S01",
          "shape_id": 7,
          "shape_type": "text",
          "name": "Material: gauge status arc",
          "x_in": 1.1,
          "y_in": 1.95,
          "w_in": 3.95,
          "h_in": 3.2,
          "area_ratio": 0.126403,
          "text": "",
          "font_sizes_pt": [],
          "fill_colors": [],
          "line_colors": [],
          "source_relationship": null,
          "font_families": [],
          "image_ext": null,
          "image_px": null
        },
        {
          "object_id": "ppt-object-1-7",
          "slide_id": "S01",
          "shape_id": 8,
          "shape_type": "text",
          "name": "Text: 74",
          "x_in": 2.5,
          "y_in": 3.22,
          "w_in": 1.05,
          "h_in": 0.38,
          "area_ratio": 0.00399,
          "text": "74",
          "font_sizes_pt": [
            31.0
          ],
          "fill_colors": [],
          "line_colors": [],
          "source_relationship": null,
          "font_families": [
            "Microsoft YaHei"
          ],
          "image_ext": null,
          "image_px": null
        },
        {
          "object_id": "ppt-object-1-8",
          "slide_id": "S01",
          "shape_id": 9,
          "shape_type": "text",
          "name": "Text: Readiness index",
          "x_in": 2.2,
          "y_in": 3.72,
          "w_in": 1.66,
          "h_in": 0.18,
          "area_ratio": 0.002988,
          "text": "Readiness index",
          "font_sizes_pt": [
            8.8
          ],
          "fill_colors": [],
          "line_colors": [],
          "source_relationship": null,
          "font_families": [
            "Microsoft YaHei"
          ],
          "image_ext": null,
          "image_px": null
        },
        {
          "object_id": "ppt-object-1-9",
          "slide_id": "S01",
          "shape_id": 10,
          "shape_type": "text",
          "name": "Material: legend dot",
          "x_in": 1.25,
          "y_in": 4.85,
          "w_in": 0.12,
          "h_in": 0.12,
          "area_ratio": 0.000144,
          "text": "",
          "font_sizes_pt": [],
          "fill_colors": [
            "#D92D20"
          ],
          "line_colors": [],
          "source_relationship": null,
          "font_families": [],
          "image_ext": null,
          "image_px": null
        },
        {
          "object_id": "ppt-object-1-10",
          "slide_id": "S01",
          "shape_id": 11,
          "shape_type": "text",
          "name": "Text: Risk zone",
          "x_in": 1.43,
          "y_in": 4.8,
          "w_in": 1.2,
          "h_in": 0.18,
          "area_ratio": 0.00216,
          "text": "Risk zone",
          "font_sizes_pt": [
            8.19
          ],
          "fill_colors": [],
          "line_colors": [],
          "source_relationship": null,
          "font_families": [
            "Microsoft YaHei"
          ],
          "image_ext": null,
          "image_px": null
        },
        {
          "object_id": "ppt-object-1-11",
          "slide_id": "S01",
          "shape_id": 12,
          "shape_type": "text",
          "name": "Text: 0-55",
          "x_in": 2.25,
          "y_in": 4.8,
          "w_in": 0.6,
          "h_in": 0.18,
          "area_ratio": 0.00108,
          "text": "0-55",
          "font_sizes_pt": [
            8.19
          ],
          "fill_colors": [],
          "line_colors": [],
          "source_relationship": null,
          "font_families": [
            "Microsoft YaHei"
          ],
          "image_ext": null,
          "image_px": null
        },
        {
          "object_id": "ppt-object-1-12",
          "slide_id": "S01",
          "shape_id": 13,
          "shape_type": "text",
          "name": "Material: legend dot",
          "x_in": 3.12,
          "y_in": 4.85,
          "w_in": 0.12,
          "h_in": 0.12,
          "area_ratio": 0.000144,
          "text": "",
          "font_sizes_pt": [],
          "fill_colors": [
            "#F2C94C"
          ],
          "line_colors": [],
          "source_relationship": null,
          "font_families": [],
          "image_ext": null,
          "image_px": null
        },
        {
          "object_id": "ppt-object-1-13",
          "slide_id": "S01",
          "shape_id": 14,
          "shape_type": "text",
          "name": "Text: Watch",
          "x_in": 3.3,
          "y_in": 4.8,
          "w_in": 1.2,
          "h_in": 0.18,
          "area_ratio": 0.00216,
          "text": "Watch",
          "font_sizes_pt": [
            8.19
          ],
          "fill_colors": [],
          "line_colors": [],
          "source_relationship": null,
          "font_families": [
            "Microsoft YaHei"
          ],
          "image_ext": null,
          "image_px": null
        },
        {
          "object_id": "ppt-object-1-14",
          "slide_id": "S01",
          "shape_id": 15,
          "shape_type": "text",
          "name": "Text: 56-70",
          "x_in": 4.12,
          "y_in": 4.8,
          "w_in": 0.6,
          "h_in": 0.18,
          "area_ratio": 0.00108,
          "text": "56-70",
          "font_sizes_pt": [
            8.19
          ],
          "fill_colors": [],
          "line_colors": [],
          "source_relationship": null,
          "font_families": [
            "Microsoft YaHei"
          ],
          "image_ext": null,
          "image_px": null
        },
        {
          "object_id": "ppt-object-1-15",
          "slide_id": "S01",
          "shape_id": 16,
          "shape_type": "text",
          "name": "Material: legend dot",
          "x_in": 4.78,
          "y_in": 4.85,
          "w_in": 0.12,
          "h_in": 0.12,
          "area_ratio": 0.000144,
          "text": "",
          "font_sizes_pt": [],
          "fill_colors": [
            "#2E7D32"
          ],
          "line_colors": [],
          "source_relationship": null,
          "font_families": [],
          "image_ext": null,
          "image_px": null
        },
        {
          "object_id": "ppt-object-1-16",
          "slide_id": "S01",
          "shape_id": 17,
          "shape_type": "text",